<?xml version="1.0" encoding="UTF-8" ?>
<PuurchaseOrder OrderDate="1999-10-20"
           xmlns:xsi="http://www.w3.org/2001/XMLSchema-instance"
           xsi:schemaLocation="src/controlWork2/task3/PurchaseOrder.xsd PurchaseOrder.xsd">
    <Item PartNumber="872-AA">
        <ProductName>Lawnmower</ProductName>
        <Quantity>1</Quantity>
        <USPrice>148,95</USPrice>
        <Comment>Confirm this is electric</Comment>
    </Item>
    <Item PartNumber="926-AA">
        <ProductName>Baby Monitor</ProductName>
        <Quantity>2</Quantity>
        <USPrice>39,98</USPrice>
        <ShipDate>1999-05-21</ShipDate>
    </Item>
</PuurchaseOrder>